{
  "handoffId": "handoff_01K3H002",
  "fromAgentId": "agent.support.refunds",
  "toAgentId": "agent.support.payments",
  "taskRef": "task_01K3TASK0001",
  "reason": "payment_ledger_investigation_required",
  "createdAt": "2026-04-28T22:10:20Z",
  "runId": "run_01K3RUN0001",
  "correlationId": "run_01K3RUN0001",
  "capabilityTokenRef": "tok_01K3EXAMPLE0002",
  "budgetRef": "bud_01K3BUDGET001"
}
